{
  "$schema": "https://json-schema.org/draft/2020-12/schema",
  "$id": "https://github.com/fysoul17/devlyn-cli/config/skills/_shared/expected.schema.json",
  "title": "spec.expected.json — mechanical acceptance contract",
  "description": "Load-bearing LLM-agnostic decoupler for the devlyn-cli harness. Defines the machine-readable acceptance criteria a spec ships alongside spec.md. Stable across model upgrades — when Opus 5 / GPT-6 / Qwen / Gemini land, this schema does not move; only the per-model adapter files in _shared/adapters/ do.",
  "type": "object",
  "additionalProperties": false,
  "properties": {
    "process_evidence": {
      "type": "array",
      "description": "Declared process obligations captured during implementation. Each id is unique within its phase; the shared process-evidence runner records raw streams and validates the expectation before IMPLEMENT can pass.",
      "items": {
        "type": "object",
        "additionalProperties": false,
        "required": ["id", "phase"],
        "oneOf": [
          { "required": ["cmd"], "not": { "required": ["argv"] } },
          { "required": ["argv"], "not": { "required": ["cmd"] } }
        ],
        "properties": {
          "id": {
            "type": "string",
            "pattern": "^[A-Za-z0-9][A-Za-z0-9._-]{0,127}$",
            "description": "Stable evidence id, unique within its phase and safe as one path component."
          },
          "phase": {
            "const": "implement",
            "description": "The phase that must produce this expected-contract obligation."
          },
          "cmd": {
            "type": "string",
            "minLength": 1,
            "description": "Exact shell command executed by the shared runner."
          },
          "argv": {
            "type": "array",
            "minItems": 1,
            "items": { "type": "string" },
            "description": "Exact argv executed without a shell; argv[0] must be non-empty."
          },
          "exit_code": {
            "type": "integer",
            "minimum": 0,
            "description": "Required exit code. Default 0 if omitted.",
            "default": 0
          },
          "timeout_sec": {
            "type": "integer",
            "minimum": 1,
            "maximum": 600,
            "description": "Per-command timeout in seconds. Default 60 if omitted.",
            "default": 60
          },
          "stdout_contains": {
            "type": "array",
            "items": { "type": "string", "minLength": 1 },
            "description": "Each UTF-8 substring must occur in the concatenated raw stdout and stderr bytes.",
            "default": []
          },
          "stdout_not_contains": {
            "type": "array",
            "items": { "type": "string", "minLength": 1 },
            "description": "No UTF-8 substring may occur in the concatenated raw stdout and stderr bytes.",
            "default": []
          }
        }
      },
      "default": []
    },
    "verification_commands": {
      "type": "array",
      "description": "Each command is executed against the post-BUILD code. Each pass/fail contributes to verify_score. At least one entry is required when the spec has any observable runtime check (CLI, test command, HTTP request).",
      "items": {
        "type": "object",
        "additionalProperties": false,
        "oneOf": [
          { "required": ["cmd"], "not": { "required": ["argv"] } },
          { "required": ["argv"], "not": { "required": ["cmd"] } }
        ],
        "properties": {
          "cmd": {
            "type": "string",
            "description": "Shell command, executed via `subprocess.run(..., shell=True)` from the build's working directory.",
            "minLength": 1
          },
          "argv": {
            "type": "array",
            "minItems": 1,
            "items": { "type": "string" },
            "description": "Exact argv executed without a shell; argv[0] must be non-empty. Preferred for generated and Windows contracts. The resolve spec-verify gate executes cmd only; the ideate loop acceptance runner executes both."
          },
          "exit_code": {
            "type": "integer",
            "description": "Required exit code. Default 0 if omitted.",
            "default": 0
          },
          "timeout_sec": {
            "type": "integer",
            "minimum": 1,
            "maximum": 600,
            "description": "Per-command timeout in seconds. Default 60 if omitted; maximum 600.",
            "default": 60
          },
          "stdout_contains": {
            "type": "array",
            "description": "Each substring must appear verbatim in (stdout + stderr) for pass.",
            "items": { "type": "string", "minLength": 1 },
            "default": []
          },
          "stdout_not_contains": {
            "type": "array",
            "description": "None of these substrings may appear in (stdout + stderr) for pass.",
            "items": { "type": "string", "minLength": 1 },
            "default": []
          },
          "contract_refs": {
            "type": "array",
            "description": "Visible requirements this command verifies. Ideate loop tasks name requirement IDs (R1, R2, ...) from the task Requirements and require at least one; hidden BENCH_FIXTURE_DIR commands name exact spec.md substrings and may test only visible spec clauses.",
            "items": { "type": "string", "minLength": 1 },
            "default": []
          }
        }
      }
    },
    "forbidden_patterns": {
      "type": "array",
      "description": "Regex patterns scanned across diff.patch. Match at severity=disqualifier is a hard-floor fail; match at severity=warning is judge-only critical-finding.",
      "items": {
        "type": "object",
        "additionalProperties": false,
        "required": ["pattern", "description", "severity"],
        "properties": {
          "pattern": {
            "type": "string",
            "description": "Python re.search-compatible regex. Anchored implicitly by the surrounding regex, NOT by ^ / $ unless intended.",
            "minLength": 1
          },
          "description": {
            "type": "string",
            "description": "Human-readable explanation of what the pattern catches and why it's forbidden.",
            "minLength": 1
          },
          "files": {
            "type": "array",
            "description": "Optional allow-list of files (substrings of diff --git lines). When present, scan is sliced to hunks touching only these files.",
            "items": { "type": "string", "minLength": 1 },
            "default": []
          },
          "severity": {
            "type": "string",
            "enum": ["disqualifier", "warning"],
            "description": "disqualifier = hard-floor fail (DQ). warning = judge-visible critical-finding only."
          }
        }
      }
    },
    "required_files": {
      "type": "array",
      "description": "Files specified by literal paths that must exist after the arm runs; globs are not expanded.",
      "items": { "type": "string", "minLength": 1 },
      "default": []
    },
    "forbidden_files": {
      "type": "array",
      "description": "Exact Git-relative paths (forward slashes, no leading ./) that must NOT appear in the diff, including both rename names; globs and directory prefixes are not expanded.",
      "items": { "type": "string", "minLength": 1 },
      "default": []
    },
    "tier_a_waivers": {
      "type": "array",
      "description": "Optional fnmatch globs exempted from Tier A scope-oracle path checks when the spec explicitly authorizes those files.",
      "items": { "type": "string", "minLength": 1 },
      "default": []
    },
    "spec_output_files": {
      "type": "array",
      "description": "Files or globs that define the spec-authorized output surface for scope oracles. Touched files outside this set must be reachable from it via static imports or separately waived.",
      "items": { "type": "string", "minLength": 1 },
      "default": []
    },
    "max_deps_added": {
      "type": "integer",
      "description": "Hard cap on new entries under dependencies/devDependencies in package.json. Exceeds → DQ.",
      "minimum": 0,
      "default": 0
    },
    "pure_design": {
      "type": "boolean",
      "description": "Declares that every Requirement is pure-design (no observable runtime check). Lets verification_commands stay empty without failing shape validation. Contradictory (and rejected) when true alongside a non-empty verification_commands.",
      "default": false
    },
    "required_risk_probe_requirements": {
      "type": "array",
      "description": "Language-neutral replacement for prose-keyword risk-probe classification: explicit {tag, derived_from} obligations the spec author declares directly. When `--risk-probes` is enabled, risk-probes.jsonl must include a probe whose tags include `tag` and whose derived_from exactly equals `derived_from` for each entry.",
      "items": {
        "type": "object",
        "additionalProperties": false,
        "required": ["tag", "derived_from"],
        "properties": {
          "tag": {
            "type": "string",
            "description": "One of the risk-probe tags defined in _shared/expected-contract.py:RISK_PROBE_TAGS (e.g. ordering_inversion, rollback_state, shape_contract)."
          },
          "derived_from": {
            "type": "string",
            "description": "Exact substring of the sibling spec.md's visible verification section that demands this tag.",
            "minLength": 1
          }
        }
      },
      "default": []
    }
  }
}
