{
  "verification_commands": [
    {
      "cmd": "node --test tests/cli.test.js",
      "exit_code": 0,
      "stdout_contains": [],
      "stdout_not_contains": ["not ok "]
    },
    {
      "cmd": "node \"$BENCH_FIXTURE_DIR/verifiers/priority-stock-reservation.js\"",
      "exit_code": 0,
      "stdout_contains": ["\"ok\":true"],
      "stdout_not_contains": [],
      "contract_refs": [
        "Process orders globally by `priority` descending, then original input order ascending.",
        "A reservation is all-or-nothing per order. It accepts only when the SKU exists and remaining stock has at least `qty`.",
        "A rejected reservation must not change stock. Use reason `unknown_sku` when the SKU is absent, or `insufficient_stock` when the SKU exists but lacks enough remaining stock.",
        "`reserved` is ordered by processing order. Each row has keys `id`, `sku`, `qty`.",
        "`rejected` is ordered in the original input order. Each row has keys `id`, `reason`.",
        "`stock` is an object whose keys are sorted alphabetically and whose values are remaining quantities.",
        "On success, write exactly one JSON object to stdout and no stderr. Keys: `reserved`, `rejected`, `stock`."
      ]
    },
    {
      "cmd": "node \"$BENCH_FIXTURE_DIR/verifiers/duplicate-order-error.js\"",
      "exit_code": 0,
      "stdout_contains": ["\"ok\":true"],
      "stdout_not_contains": [],
      "contract_refs": [
        "Before processing any order, duplicate order ids are invalid input: exit `2`, write exactly one JSON error object `{ \"error\": \"duplicate_order_id\", \"id\": string }` to stderr, and write no stdout."
      ]
    }
  ],
  "forbidden_patterns": [
    {
      "pattern": "catch\\s*\\([^)]*\\)\\s*\\{[^}]*return\\s+(null|undefined|''|\\{\\}|\\[\\])",
      "description": "silent catch returning fallback in reserve-stock path",
      "files": ["bin/cli.js", "tests/cli.test.js"],
      "severity": "disqualifier"
    },
    {
      "pattern": "catch\\s*\\([^)]*\\)\\s*\\{\\s*\\}",
      "description": "empty catch block",
      "files": ["bin/cli.js", "tests/cli.test.js"],
      "severity": "disqualifier"
    }
  ],
  "required_files": ["bin/cli.js", "tests/cli.test.js"],
  "forbidden_files": [],
  "tier_a_waivers": [],
  "spec_output_files": ["bin/cli.js", "tests/cli.test.js"],
  "max_deps_added": 0
}
