{
  "verification_commands": [
    {
      "cmd": "python3 config/skills/_shared/task-complete.py --self-test",
      "exit_code": 0,
      "timeout_sec": 300
    },
    {
      "cmd": "python3 config/skills/_shared/resolve-bootstrap.py --self-test",
      "exit_code": 0,
      "timeout_sec": 300
    },
    {
      "cmd": "python3 config/skills/_shared/archive_run.py --self-test",
      "exit_code": 0,
      "timeout_sec": 120
    },
    {
      "cmd": "grep -rnE 'def prune|prune\\(|--keep' config/skills/_shared/archive_run.py config/skills/_shared/resolve-bootstrap.py .agents/skills/_shared/archive_run.py .agents/skills/_shared/resolve-bootstrap.py",
      "exit_code": 1,
      "timeout_sec": 30
    },
    {
      "cmd": "bash scripts/lint-skills.sh",
      "exit_code": 0,
      "timeout_sec": 600
    },
    {
      "cmd": "git diff --check",
      "exit_code": 0,
      "timeout_sec": 60
    }
  ],
  "max_deps_added": 0,
  "forbidden_files": [
    "package.json",
    "bin/devlyn.js"
  ],
  "required_risk_probe_requirements": [
    {
      "tag": "idempotency_replay",
      "derived_from": "a crash after the tombstone rename resumes to RETIRED and touches nothing else"
    },
    {
      "tag": "concurrent_state_consistency",
      "derived_from": "a contended bootstrap admission lock"
    },
    {
      "tag": "rollback_state",
      "derived_from": "yields CLEANUP_PENDING with paths and resume, delivery status unchanged, nothing deleted"
    }
  ]
}
